{
  "scan_id": "20261105T093000Z-before",
  "timestamp": "2026-11-05T09:30:00Z",
  "account_id": "123456789012",
  "region": "ap-south-1",
  "label": "before",
  "summary": {
    "score": 51,
    "total": 11,
    "failed": 5,
    "by_severity": {
      "CRITICAL": 1,
      "HIGH": 3,
      "MEDIUM": 0,
      "LOW": 1
    }
  },
  "findings": [
    {
      "id": "CT-001#123456789012",
      "check_id": "CT-001",
      "title": "No active multi-region CloudTrail trail",
      "service": "cloudtrail",
      "resource_id": "123456789012",
      "resource_arn": "arn:aws:cloudtrail:ap-south-1:123456789012:trail/cspm-demo-trail",
      "severity": "MEDIUM",
      "status": "PASS",
      "description": "Trail cspm-demo-trail is multi-region and logging is on.",
      "remediation_hint": "Create a multi-region CloudTrail trail and make sure logging is turned on.",
      "auto_remediable": false,
      "remediation_action": "NONE"
    },
    {
      "id": "EC2-001#sg-0a1b2c3d4e5f60718",
      "check_id": "EC2-001",
      "title": "Security group allows open ingress to the internet",
      "service": "ec2",
      "resource_id": "sg-0a1b2c3d4e5f60718",
      "resource_arn": "arn:aws:ec2:ap-south-1:123456789012:security-group/sg-0a1b2c3d4e5f60718",
      "severity": "HIGH",
      "status": "FAIL",
      "description": "Security group cspm-demo-vuln-sg allows 0.0.0.0/0 on port 22 (SSH).",
      "remediation_hint": "Remove the 0.0.0.0/0 and ::/0 ingress rules for SSH (22), RDP (3389) or all ports.",
      "auto_remediable": true,
      "remediation_action": "EC2_REVOKE_OPEN_INGRESS"
    },
    {
      "id": "EC2-001#sg-0f9e8d7c6b5a43210",
      "check_id": "EC2-001",
      "title": "Security group allows open ingress to the internet",
      "service": "ec2",
      "resource_id": "sg-0f9e8d7c6b5a43210",
      "resource_arn": "arn:aws:ec2:ap-south-1:123456789012:security-group/sg-0f9e8d7c6b5a43210",
      "severity": "HIGH",
      "status": "PASS",
      "description": "No ingress rule is open to the internet on port 22, 3389 or all ports.",
      "remediation_hint": "Remove the 0.0.0.0/0 and ::/0 ingress rules for SSH (22), RDP (3389) or all ports.",
      "auto_remediable": true,
      "remediation_action": "EC2_REVOKE_OPEN_INGRESS"
    },
    {
      "id": "IAM-001#cspm-demo-vuln-user",
      "check_id": "IAM-001",
      "title": "IAM user has AdministratorAccess attached directly",
      "service": "iam",
      "resource_id": "cspm-demo-vuln-user",
      "resource_arn": "arn:aws:iam::123456789012:user/cspm-demo-vuln-user",
      "severity": "HIGH",
      "status": "FAIL",
      "description": "AdministratorAccess is attached directly to the user.",
      "remediation_hint": "Detach AdministratorAccess from the user and grant only the permissions they need.",
      "auto_remediable": true,
      "remediation_action": "IAM_DETACH_ADMIN_POLICY"
    },
    {
      "id": "IAM-002#cspm-demo-vuln-user",
      "check_id": "IAM-002",
      "title": "IAM user has console access but no MFA",
      "service": "iam",
      "resource_id": "cspm-demo-vuln-user",
      "resource_arn": "arn:aws:iam::123456789012:user/cspm-demo-vuln-user",
      "severity": "HIGH",
      "status": "FAIL",
      "description": "User has a console password but no MFA device registered.",
      "remediation_hint": "Register an MFA device for the user, or remove their console login profile. Needs a human.",
      "auto_remediable": false,
      "remediation_action": "NONE"
    },
    {
      "id": "S3-001#cspm-demo-reports-123456789012",
      "check_id": "S3-001",
      "title": "S3 bucket is publicly accessible",
      "service": "s3",
      "resource_id": "cspm-demo-reports-123456789012",
      "resource_arn": "arn:aws:s3:::cspm-demo-reports-123456789012",
      "severity": "CRITICAL",
      "status": "PASS",
      "description": "Block Public Access is fully enabled; the bucket is not public.",
      "remediation_hint": "Enable all four Block Public Access settings.",
      "auto_remediable": true,
      "remediation_action": "S3_ENABLE_BPA"
    },
    {
      "id": "S3-001#cspm-demo-trail-logs-123456789012",
      "check_id": "S3-001",
      "title": "S3 bucket is publicly accessible",
      "service": "s3",
      "resource_id": "cspm-demo-trail-logs-123456789012",
      "resource_arn": "arn:aws:s3:::cspm-demo-trail-logs-123456789012",
      "severity": "CRITICAL",
      "status": "PASS",
      "description": "Block Public Access is fully enabled; the bucket is not public.",
      "remediation_hint": "Enable all four Block Public Access settings.",
      "auto_remediable": true,
      "remediation_action": "S3_ENABLE_BPA"
    },
    {
      "id": "S3-001#cspm-demo-vuln-bucket-123456789012",
      "check_id": "S3-001",
      "title": "S3 bucket is publicly accessible",
      "service": "s3",
      "resource_id": "cspm-demo-vuln-bucket-123456789012",
      "resource_arn": "arn:aws:s3:::cspm-demo-vuln-bucket-123456789012",
      "severity": "CRITICAL",
      "status": "FAIL",
      "description": "Public read is granted by bucket policy and Block Public Access is off.",
      "remediation_hint": "Enable all four Block Public Access settings.",
      "auto_remediable": true,
      "remediation_action": "S3_ENABLE_BPA"
    },
    {
      "id": "S3-002#cspm-demo-reports-123456789012",
      "check_id": "S3-002",
      "title": "S3 bucket versioning is disabled",
      "service": "s3",
      "resource_id": "cspm-demo-reports-123456789012",
      "resource_arn": "arn:aws:s3:::cspm-demo-reports-123456789012",
      "severity": "LOW",
      "status": "PASS",
      "description": "Versioning is enabled.",
      "remediation_hint": "Enable versioning on the bucket.",
      "auto_remediable": true,
      "remediation_action": "S3_ENABLE_VERSIONING"
    },
    {
      "id": "S3-002#cspm-demo-trail-logs-123456789012",
      "check_id": "S3-002",
      "title": "S3 bucket versioning is disabled",
      "service": "s3",
      "resource_id": "cspm-demo-trail-logs-123456789012",
      "resource_arn": "arn:aws:s3:::cspm-demo-trail-logs-123456789012",
      "severity": "LOW",
      "status": "PASS",
      "description": "Versioning is enabled.",
      "remediation_hint": "Enable versioning on the bucket.",
      "auto_remediable": true,
      "remediation_action": "S3_ENABLE_VERSIONING"
    },
    {
      "id": "S3-002#cspm-demo-vuln-bucket-123456789012",
      "check_id": "S3-002",
      "title": "S3 bucket versioning is disabled",
      "service": "s3",
      "resource_id": "cspm-demo-vuln-bucket-123456789012",
      "resource_arn": "arn:aws:s3:::cspm-demo-vuln-bucket-123456789012",
      "severity": "LOW",
      "status": "FAIL",
      "description": "Versioning is not enabled on this bucket.",
      "remediation_hint": "Enable versioning on the bucket.",
      "auto_remediable": true,
      "remediation_action": "S3_ENABLE_VERSIONING"
    }
  ]
}
